<?xml version="1.0" encoding="UTF-8" ?>
<flowers xmlns:xsi="http://www.w3.org/2001/XMLSchema-instance" xmlns="http://www.example.com/flower"
         xsi:noNamespaceSchemaLocation="flower.xsd">
    <flower soil="podzolic">
        <name>Azalea</name>
        <origin>Bel</origin>
        <visual>
            <stem>red</stem>
            <sheet>green</sheet>
            <size>20</size>
        </visual>
        <growing>
            <temperature>10</temperature>
            <lighting>true</lighting>
            <irrigation>30</irrigation>
        </growing>
        <multiplying>sheets</multiplying>
        <date>2018-09-01</date>
    </flower>
    <flower soil="podzolic">
        <name>Aloe</name>
        <origin>Bel</origin>
        <visual>
            <stem>red</stem>
            <sheet>green</sheet>
            <size>20</size>
        </visual>
        <growing>
            <temperature>10</temperature>
            <lighting>true</lighting>
            <irrigation>30</irrigation>
        </growing>
        <multiplying>sheets</multiplying>
        <date>2017-12-10</date>
    </flower>
    <flower soil="podzolic">
        <name>Pansies</name>
        <origin>Ru</origin>
        <visual>
            <stem>red</stem>
            <sheet>green</sheet>
            <size>20</size>
        </visual>
        <growing>
            <temperature>10</temperature>
            <lighting>true</lighting>
            <irrigation>30</irrigation>
        </growing>
        <multiplying>sheets</multiplying>
        <date>2017-10-02</date>
    </flower>
    <flower soil="podzolic">
        <name>Aster</name>
        <origin>Ru</origin>
        <visual>
            <stem>red</stem>
            <sheet>green</sheet>
            <size>20</size>
        </visual>
        <growing>
            <temperature>10</temperature>
            <lighting>true</lighting>
            <irrigation>30</irrigation>
        </growing>
        <multiplying>sheets</multiplying>
        <date>2018-09-01</date>
    </flower>
    <flower soil="podzolic">
        <name>Begonia</name>
        <origin>En</origin>
        <visual>
            <stem>red</stem>
            <sheet>green</sheet>
            <size>20</size>
        </visual>
        <growing>
            <temperature>10</temperature>
            <lighting>true</lighting>
            <irrigation>30</irrigation>
        </growing>
        <multiplying>sheets</multiplying>
        <date>2018-10-01</date>
    </flower>
    <flower soil="podzolic">
        <name>Cornflower</name>
        <origin>En</origin>
        <visual>
            <stem>red</stem>
            <sheet>green</sheet>
            <size>20</size>
        </visual>
        <growing>
            <temperature>10</temperature>
            <lighting>true</lighting>
            <irrigation>30</irrigation>
        </growing>
        <multiplying>sheets</multiplying>
        <date>2018-10-01</date>
    </flower>
    <flower soil="ground">
        <name>Verbena</name>
        <origin>En</origin>
        <visual>
            <stem>red</stem>
            <sheet>green</sheet>
            <size>20</size>
        </visual>
        <growing>
            <temperature>10</temperature>
            <lighting>true</lighting>
            <irrigation>30</irrigation>
        </growing>
        <multiplying>cuttings</multiplying>
        <date>2017-11-12</date>
    </flower>
    <flower soil="ground">
        <name>Carnation</name>
        <origin>Fr</origin>
        <visual>
            <stem>red</stem>
            <sheet>green</sheet>
            <size>20</size>
        </visual>
        <growing>
            <temperature>10</temperature>
            <lighting>true</lighting>
            <irrigation>30</irrigation>
        </growing>
        <multiplying>cuttings</multiplying>
        <date>2017-11-12</date>
    </flower>
    <flower soil="ground">
        <name>Dahlia</name>
        <origin>Fr</origin>
        <visual>
            <stem>red</stem>
            <sheet>green</sheet>
            <size>20</size>
        </visual>
        <growing>
            <temperature>10</temperature>
            <lighting>true</lighting>
            <irrigation>30</irrigation>
        </growing>
        <multiplying>cuttings</multiplying>
        <date>2017-11-12</date>
    </flower>
    <flower soil="ground">
        <name>Geranium</name>
        <origin>Bel</origin>
        <visual>
            <stem>red</stem>
            <sheet>green</sheet>
            <size>20</size>
        </visual>
        <growing>
            <temperature>10</temperature>
            <lighting>true</lighting>
            <irrigation>30</irrigation>
        </growing>
        <multiplying>cuttings</multiplying>
        <date>2018-06-12</date>
    </flower>
    <flower soil="ground">
        <name>Herbera</name>
        <origin>Yulia</origin>
        <visual>
            <stem>red</stem>
            <sheet>green</sheet>
            <size>20</size>
        </visual>
        <growing>
            <temperature>10</temperature>
            <lighting>true</lighting>
            <irrigation>30</irrigation>
        </growing>
        <multiplying>seeds</multiplying>
        <date>2018-06-12</date>
    </flower>
    <flower soil="sod-podzolic">
        <name>Glcinia</name>
        <origin>Bel</origin>
        <visual>
            <stem>red</stem>
            <sheet>green</sheet>
            <size>20</size>
        </visual>
        <growing>
            <temperature>10</temperature>
            <lighting>true</lighting>
            <irrigation>30</irrigation>
        </growing>
        <multiplying>seeds</multiplying>
        <date>2018-06-12</date>
    </flower>
    <flower soil="sod-podzolic">
        <name>Cow-Wheat</name>
        <origin>Ru</origin>
        <visual>
            <stem>red</stem>
            <sheet>green</sheet>
            <size>20</size>
        </visual>
        <growing>
            <temperature>10</temperature>
            <lighting>true</lighting>
            <irrigation>30</irrigation>
        </growing>
        <multiplying>seeds</multiplying>
        <date>2018-05-10</date>
    </flower>
    <flower soil="sod-podzolic">
        <name>WillowHerb</name>
        <origin>Ru</origin>
        <visual>
            <stem>red</stem>
            <sheet>green</sheet>
            <size>20</size>
        </visual>
        <growing>
            <temperature>10</temperature>
            <lighting>true</lighting>
            <irrigation>30</irrigation>
        </growing>
        <multiplying>seeds</multiplying>
        <date>2018-05-10</date>
    </flower>
    <flower soil="sod-podzolic">
        <name>Iris</name>
        <origin>En</origin>
        <visual>
            <stem>red</stem>
            <sheet>green</sheet>
            <size>20</size>
        </visual>
        <growing>
            <temperature>10</temperature>
            <lighting>true</lighting>
            <irrigation>30</irrigation>
        </growing>
        <multiplying>seeds</multiplying>
        <date>2018-05-11</date>
    </flower>
    <flower soil="sod-podzolic">
        <name>Cannee</name>
        <origin>En</origin>
        <visual>
            <stem>red</stem>
            <sheet>green</sheet>
            <size>20</size>
        </visual>
        <growing>
            <temperature>10</temperature>
            <lighting>true</lighting>
            <irrigation>30</irrigation>
        </growing>
        <multiplying>seeds</multiplying>
        <date>2018-05-11</date>
    </flower>
</flowers>